,name_food,calories,link
0,Ensalada de escarola y granada para navidad,210,https://queapetito.com/receta-ensalada-escarola-granada-navidad/
1,Ensalada Templada de Pollo y Bacon,319,https://queapetito.com/receta-ensalada-templada-pollo-bacon/
2,Ensalada de brócoli crudo,110,https://queapetito.com/receta-ensalada-brocoli-crudo/
3,Ensalada de lechuga con manzana y pasas,198,https://queapetito.com/receta-ensalada-lechuga-manzana-pasas/
4,Ensalada de col con queso,150,https://queapetito.com/receta-ensalada-col-queso/
5,Ensalada de tomate y pimiento asado,205,https://queapetito.com/receta-ensalada-tomate-pimiento-asado/
6,Ensalada de Trampó,58,https://queapetito.com/receta-ensalada-trampo/
7,Ensalada de lechuga con queso de cabra y jamón,190,https://queapetito.com/receta-ensalada-lechuga-queso-cabra-jamon/
8,Ensalada de alubias blancas con pesto,520,https://queapetito.com/receta-ensalada-alubias-blancas-pesto/
9,Ensalada con queso de cabra y bacón,175,https://queapetito.com/receta-ensalada-queso-cabra-bacon/
10,Ensalada de tomate y queso feta,198,https://queapetito.com/receta-ensalada-tomate-queso-feta/
11,Ensalada de brócoli con quinoa y lima,210,https://queapetito.com/receta-ensalada-brocoli-quinoa-lima/
12,Ensalada de Lechuga Romana,67,https://queapetito.com/receta-ensalada-lechuga-romana/
13,Ensalada de brócoli con atún y huevo duro,172,https://queapetito.com/receta-ensalada-brocoli-atun-huevo-duro/
14,Ensalada con arándanos,190,https://queapetito.com/receta-ensalada-arandanos/
15,Ensalada de apio y naranja,200,https://queapetito.com/receta-ensalada-apio-naranja/
16,Ensalada de pasta con salsa cesar,322,https://queapetito.com/receta-ensalada-pasta-salsa-cesar/
17,Ensalada de lechuga y rabanitos,90,https://queapetito.com/receta-lechuga-rabanitos/
18,Ensalada de Lechuga con Mango y Almendras,74,https://queapetito.com/receta-ensalada-lechuga-mango-almendras/
19,Ensalada de col con thermomix,180,https://queapetito.com/receta-ensalada-col-thermomix/
20,Ensalada de manzana y pasas,120,https://queapetito.com/receta-ensalada-manzana-pasas/
21,Ensalada de manzana y maíz,170,https://queapetito.com/receta-ensalada-manzana-maiz/
22,Ensalada de arroz con atún y tocineta,220,https://queapetito.com/receta-ensalada-arroz-atun-tocineta/
23,Ensalada de lechuga y tomate al orégano,80,https://queapetito.com/receta-ensalada-lechuga-tomate-oregano/
24,Ensalada de Lechuga y Tomate con Aderezo Chino,120,https://queapetito.com/receta-ensalada-lechuga-tomate-aderezo-chino/
25,Ensalada con tomates cherry,180,https://queapetito.com/receta-ensalada-tomates-cherry/
26,Ensalada Mozárabe,350,https://queapetito.com/receta-ensalada-mozarabe/
27,Ensalada de brócoli con frutos secos,290,https://queapetito.com/receta-ensalada-brocoli-frutos-secos/
28,Ensalada césar con picatostes,320,https://queapetito.com/receta-ensalada-cesar-picatostes/
29,Ensalada de lechuga con zanahoria y queso,130,https://queapetito.com/receta-ensalada-lechuga-zanahoria-queso/
30,Ensalada templada de salmón ahumado,200,https://queapetito.com/receta-ensalada-templada-salmon-ahumado/
31,Ensalada de Lechuga con Mostaza,131,https://queapetito.com/receta-ensalada-lechuga-mostaza/
32,Ensalada de lechuga con encurtidos,170,https://queapetito.com/receta-ensalada-lechuga-encurtidos/
33,Coles de Bruselas en Salsa,78,https://queapetito.com/receta-coles-bruselas-salsa/
34,Ensalada de lechuga con pollo y queso,230,https://queapetito.com/receta-ensalada-lechuga-pollo-queso/
35,Ensalada Templada de Pera,170,https://queapetito.com/receta-ensalada-templada-pera/
36,Ensalada templada de setas y gambas,230,https://queapetito.com/receta-ensalada-templada-setas-gambas/
37,Ensalada de pasta de colores,300,https://queapetito.com/receta-ensalada-pasta-colores/
38,Ensalada de brócoli y cebolla morada,80,https://queapetito.com/receta-ensalada-brocoli-cebolla-morada/
39,"Ensalada de lechuga, zanahoria y betabel",311,https://queapetito.com/receta-ensalada-lechuga-zanahoria-betabel/
40,Ensalada con queso parmesano,55,https://queapetito.com/receta-ensalada-queso-parmesano/
41,Ensalada baviera,250,https://queapetito.com/receta-ensalada-baviera/
42,Ensalada brasileña,255,https://queapetito.com/receta-ensalada-brasilena/
43,Ensalada de ahumados con gulas,280,https://queapetito.com/receta-ensalada-ahumados-gulas/
44,Ensalada de atún en escabeche,250,https://queapetito.com/receta-ensalada-atun-escabeche/
45,Ensalada de Escarola y Nueces,93,https://queapetito.com/receta-ensalada-escarola-nueces/
46,Ensalada de lechugas con aderezo de mostaza dulce,130,https://queapetito.com/receta-ensalada-lechugas-aderezo-mostaza-dulce/
47,Ensalada de berros con tomate,70,https://queapetito.com/receta-ensalada-berros-tomate/
48,Ensalada de bogavante y salmón,120,https://queapetito.com/receta-ensalada-bogavante-salmon/
49,Ensalada de atún y berenjena,171,https://queapetito.com/receta-ensalada-atun-berenjena/
50,Ensalada de endivias con granada,210,https://queapetito.com/receta-ensalada-endivias-granada/
51,Ensalada de arroz con judias verdes,140,https://queapetito.com/receta-ensalada-arroz-judias-verdes/
52,Ensalada de aguacate y fresas,200,https://queapetito.com/receta-ensalada-aguacate-fresas/
53,Ensalada de berros con huevo mollets,181,https://queapetito.com/receta-ensalada-berros-huevo-mollets/
54,Ensalada de arroz con camarones,220,https://queapetito.com/receta-ensalada-arroz-camarones/
55,Ensalada con Canónigos y Queso de Cabra,98,https://queapetito.com/receta-ensalada-canonigos-queso-cabra/
56,Tabulé con quinoa y garbanzos,300,https://queapetito.com/receta-tabule-quinoa-garbanzos/
57,Ensalada de alcachofas y lechuga,170,https://queapetito.com/receta-ensalada-alcachofas-lechuga/
58,Ensalada americana de manzana,160,https://queapetito.com/receta-ensalada-americana-manzana/
59,Ensalada de arroz con gambas,350,https://queapetito.com/receta-ensalada-arroz-gambas/
60,Ensalada caprese con salsa pesto,200,https://queapetito.com/receta-ensalada-caprese-salsa-pesto/
61,Ensalada templada de langostinos,400,https://queapetito.com/receta-ensalada-templada-langostinos/
62,Ensalada templada con ventresca,230,https://queapetito.com/receta-ensalada-templada-ventresca/
63,Ensalada templada de alcachofas,270,https://queapetito.com/receta-ensalada-templada-alcachofas/
64,Ensalada de Lechuga con Vinagreta Agridulce,89,https://queapetito.com/receta-ensalada-lechuga-vinagreta-agridulce/
65,Ensalada de Brócoli con Aguacate,168,https://queapetito.com/receta-ensalada-brocoli-aguacate/
66,Ensalada de Atún con Pepino,147,https://queapetito.com/receta-ensalada-atun-pepino/
67,Ensalada de lechuga con queso mozzarella,130,https://queapetito.com/receta-ensalada-lechuga-queso-mozzarella/
68,Ensalada de col con mayonesa,110,https://queapetito.com/receta-ensalada-col-mayonesa/
69,Ensalada de aguacate y cebolla,150,https://queapetito.com/receta-ensalada-aguacate-cebolla/
70,Ensalada de escarola y bacalao,170,https://queapetito.com/receta-ensalada-escarola-bacalao/
71,Ensalada de endivias con gulas,160,https://queapetito.com/receta-ensalada-endivias-gulas/
72,Ensalada de aguacate y jamón,280,https://queapetito.com/receta-ensalada-aguacate-jamon/
73,Ensalada de Endivias con Bacalao,79,https://queapetito.com/receta-ensalada-endivias-bacalao/
74,Ensalada de Arroz con Salmón,108,https://queapetito.com/receta-ensalada-arroz-salmon/
75,Ensalada templada de calamares,220,https://queapetito.com/receta-ensalada-templada-calamares/
76,Aguacate al surimi,270,https://queapetito.com/receta-aguacate-surimi/
77,Ensalada crudivegana,120,https://queapetito.com/receta-ensalada-crudivegana/
78,Aguacate con anchoas,180,https://queapetito.com/receta-aguacate-anchoas/
79,Ensalada Campesina,71,https://queapetito.com/receta-ensalada-campesina/
80,Ensalada de manzana verde con apio,100,https://queapetito.com/receta-ensalada-manzana-verde-apio/
81,Ensalada de aguaymanto con pollo,180,https://queapetito.com/receta-ensalada-aguaymanto-pollo/
82,Sopa de coditos fría,290,https://queapetito.com/receta-sopa-coditos-fria/
83,Ensalada de arroz integral con verduras,140,https://queapetito.com/receta-ensalada-arroz-integral-verduras/
84,Aguacates rellenos con ensalada,320,https://queapetito.com/receta-aguacates-rellenos-ensalada/
85,Ensalada asada de verduras,257,https://queapetito.com/receta-ensalada-asada-verduras/
86,Tabulé de los incas,200,https://queapetito.com/receta-tabule-incas/
87,"Ensalada de Aguacate, Pepino y Tomate",79,https://queapetito.com/receta-ensalada-aguacate-pepino-tomate/
88,"Ensalada de Manzana, Lechuga y Nueces",103,https://queapetito.com/receta-ensalada-manzana-lechuga-nueces/
89,Ensalada caprese con champiñones,177,https://queapetito.com/receta-ensalada-caprese-champinones/
90,Ensalada con huevos de codorniz,150,https://queapetito.com/receta-ensalada-huevos-codorniz/
91,Ensalada Caprese Vegana,40,https://queapetito.com/receta-ensalada-caprese-vegana/
92,Ensalada césar con pollo empanado,360,https://queapetito.com/receta-ensalada-cesar-pollo-empanado/
93,Ensalada con queso fresco y pavo,175,https://queapetito.com/receta-ensalada-queso-fresco-pavo/
94,Ensalada China con Salsa de Soja,117,https://queapetito.com/receta-ensalada-china-salsa-soja/
95,Ensalada de alubias con bacalao,280,https://queapetito.com/receta-ensalada-alubias-bacalao/
96,Ensalada de Arroz con Atún y Huevo,168,https://queapetito.com/ensalada-arroz-atun-huevo/
97,Tabulé con Langostinos,260,https://queapetito.com/receta-tabule-langostinos/
98,Ensalada agridulce colombiana,80,https://queapetito.com/receta-ensalada-agridulce-colombiana/
99,Ensalada caprese con albahaca,148,https://queapetito.com/receta-ensalada-caprese-albahaca/
100,Ensalada de betarraga y lechuga,70,https://queapetito.com/receta-ensalada-betarraga-lechuga/
101,Acelgas con Patatas y Pimentón,63,https://queapetito.com/receta-acelgas-patatas-pimenton/
102,Ensalada de aguacate y rúcula,250,https://queapetito.com/receta-ensalada-aguacate-rucula/
103,Ensalada de dátiles y naranja,180,https://queapetito.com/receta-ensalada-datiles-naranja/
104,Ensalada césar venezolana,260,https://queapetito.com/receta-ensalada-cesar-venezolana/
105,Ensalada agridulce de repollo,120,https://queapetito.com/receta-ensalada-agridulce-repollo/
106,Ensalada de cuscús y aguacate,320,https://queapetito.com/receta-ensalada-cuscus-aguacate/
107,Ensalada con piña y langostinos,300,https://queapetito.com/receta-ensalada-pina-langostinos/
108,Ensalada de aguacate y gambas,220,https://queapetito.com/receta-ensalada-aguacate-gambas/
109,Ensalada de Atún con coliflor,206,https://queapetito.com/receta-ensalada-atun-coliflor/
110,Ensalada Fattoush,113,https://queapetito.com/receta-ensalada-fattoush/
111,Ensalada asiática de verduras,165,https://queapetito.com/receta-ensalada-asiatica-verduras/
112,Ensalada de aguacate con limón,125,https://queapetito.com/receta-ensalada-aguacate-limon/
113,Ensalada con salsa de soja,108,https://queapetito.com/receta-ensalada-salsa-soja/
114,Ensalada de aguacate y marisco,288,https://queapetito.com/receta-ensalada-aguacate-marisco/
115,"Ensalada de Manzana, Apio y Berros",61,https://queapetito.com/receta-ensalada-manzana-apio-berros/
116,Ensalada americana de patatas,288,https://queapetito.com/receta-ensalada-americana-patatas/
117,Ensalada César de berros,150,https://queapetito.com/receta-ensalada-cesar-berros/
118,Ensalada de timbales de queso,140,https://queapetito.com/receta-ensalada-timbales-queso/
119,"Ensalada de manzana, piña y nueces",330,https://queapetito.com/receta-ensalada-manzana-pina-nueces/
120,Ensalada de berenjenas árabe,145,https://queapetito.com/receta-ensalada-berenjenas-arabe/
121,Ensalada de canónigos y rúcula,145,https://queapetito.com/receta-ensalada-canonigos-rucula/
122,Ensalada con huevos y anchoas,122,https://queapetito.com/receta-ensalada-huevos-anchoas/
123,Ensalada de Arroz con Atún,168,https://queapetito.com/receta-ensalada-arroz-atun/
124,Ensalada china con agar-agar,170,https://queapetito.com/receta-ensalada-china-agar-agar/
125,Ensalada con queso feta,270,https://queapetito.com/receta-ensalada-queso-feta/
126,Ensalada de endivias belgas,17,https://queapetito.com/receta-ensalada-endivias-belgas/
127,Ensalada con frutas frescas,300,https://queapetito.com/receta-ensalada-frutas-frescas/
128,Ensalada de arroz integral con aguacate,140,https://queapetito.com/receta-ensalada-arroz-integral-aguacate/
129,Ensalada de aguacate y granada,190,https://queapetito.com/receta-ensalada-aguacate-granada/
130,Ensalada de aguacate y salmón ahumado,300,https://queapetito.com/receta-ensalada-aguacate-salmon-ahumado/
131,Ensalada con cereales,220,https://queapetito.com/receta-ensalada-cereales/
132,Ensalada de alcachofas crudas,90,https://queapetito.com/receta-ensalada-alcachofas-crudas/
133,Ensalada con trigo americano y atún,270,https://queapetito.com/receta-ensalada-trigo-americano-atun/
134,Ensalada de bacalao con aguacate,230,https://queapetito.com/receta-ensalada-bacalao-aguacate/
135,Ensalada de aguacate y mejillones,350,https://queapetito.com/receta-ensalada-aguacate-mejillones/
136,Ensalada caprese con aguacate,288,https://queapetito.com/receta-ensalada-caprese-aguacate/
137,Ensalada de arroz con nueces,210,https://queapetito.com/receta-ensalada-arroz-nueces/
138,Ensalada de Almendras y pollo,363,https://queapetito.com/receta-ensalada-almendras-pollo/
139,Ensalada de apio y repollo,35,https://queapetito.com/receta-ensalada-apio-repollo/
140,Ensalada de trigo con verduras,203,https://queapetito.com/receta-ensalada-trigo-verduras/
141,Ensalada de pomelo rosa,130,https://queapetito.com/receta-ensalada-pomelo-rosa/
142,Ensalada de naranja y queso de cabra,290,https://queapetito.com/receta-ensalada-naranja-queso-cabra/
143,Ensalada con remolacha,87,https://queapetito.com/receta-ensalada-remolacha/
144,Ensalada de remolacha y patatas,168,https://queapetito.com/receta-ensalada-remolacha-patatas/
145,Judías Verdes con Tomate cherry,105,https://queapetito.com/receta-judias-verdes-tomate-cherry/
146,Ensalada turca,90,https://queapetito.com/receta-ensalada-turca/
147,Ensalada templada de vieiras,130,https://queapetito.com/receta-ensalada-templada-vieiras/
148,Ensalada toscana,250,https://queapetito.com/receta-ensalada-toscana/
149,Escarola con salsa romesco o xatonada,330,https://queapetito.com/receta-escarola-salsa-romesco-o-xatonada/
150,Ensalada de naranja y frutos secos,260,https://queapetito.com/receta-ensalada-naranja-frutos-secos/
151,Ensalada de manzana y zanahoria,380,https://queapetito.com/receta-ensalada-manzana-zanahoria/
152,Empedrat de garbanzos,358,https://queapetito.com/receta-empedrat-garbanzos/
153,Espinacas a la Catalana,168,https://queapetito.com/receta-espinacas-catalana/
154,Ensalada de manzana y remolacha,120,https://queapetito.com/receta-ensalada-manzana-remolacha/
155,Escarola con naranja,80,https://queapetito.com/receta-escarola-naranja/
156,Escarola con granada,53,https://queapetito.com/receta-escarola-granada/
157,Ensalada de pomelo y aguacate,410,https://queapetito.com/receta-ensalada-pomelo-aguacate/
158,Ensalada templada de gambas y zamburiñas,180,https://queapetito.com/receta-ensalada-templada-gambas-zamburinas/
159,Empedrat de alubias y bacalao,160,https://queapetito.com/receta-empedrat-alubias-bacalao/
160,Ensalada de naranja y miel,120,https://queapetito.com/receta-ensalada-naranja-miel/
161,"Ensalada de tofu marinado, aguacate y canónigos",220,https://queapetito.com/receta-ensalada-tofu-marinado-aguacate-canonigos/
162,Ensaladilla de pollo fácil,180,https://queapetito.com/receta-ensaladilla-pollo-facil/
163,Ensalada de manzana y queso,472,https://queapetito.com/receta-ensalada-manzana-queso/
164,Ensalada de Palmitos,60,https://queapetito.com/receta-ensalada-palmitos/
165,Ensalada de Pepino,102,https://queapetito.com/receta-ensalada-pepino/
166,Ensalada templada con tofu,100,https://queapetito.com/receta-ensalada-templada-tofu/
167,Ensalada de lentejas y quinoa vegana,375,https://queapetito.com/receta-ensalada-lentejas-quinoa-vegana/
168,Endivias a la vinagreta,380,https://queapetito.com/receta-endivias-vinagreta/
169,Judias verdes con patatas y huevos,200,https://queapetito.com/receta-judias-verdes-patatas-huevos/
170,Ensalada de endivias con anchoas,145,https://queapetito.com/receta-ensalada-endivias-anchoas/
171,Ensalada de Quínoa y Mango,288,https://queapetito.com/receta-ensalada-quinoa-mango/
172,Quinoa con almendras y pasas,220,https://queapetito.com/receta-quinoa-almendras-pasas/
173,Ensalada de pollo y aguacate,210,https://queapetito.com/receta-ensalada-pollo-aguacate/
174,Ensaladilla de remolacha,200,https://queapetito.com/receta-ensaladilla-remolacha/
175,Ensalada de endibias y aguacate,290,https://queapetito.com/receta-ensalada-endibias-aguacate/
176,Ensalada de higos y queso de cabra,120,https://queapetito.com/receta-ensalada-higos-queso-cabra/
177,Ensalada de repollo y zanahoria,180,https://queapetito.com/receta-ensalada-repollo-zanahoria/
178,Ensalada de sandía y queso,170,https://queapetito.com/receta-ensalada-sandia-queso/
179,Ensalada de pollo y manzana,290,https://queapetito.com/receta-ensalada-pollo-manzana/
180,Ensalada de maíz y aguacate,260,https://queapetito.com/receta-ensalada-maiz-aguacate/
181,Ensalada con manzana y naranja,110,https://queapetito.com/receta-ensalada-manzana-naranja/
182,Ensalada de espinacas y salmón ahumado,282,https://queapetito.com/receta-ensalada-espinacas-salmon-ahumado/
183,Ensalada de manzana y tomate,150,https://queapetito.com/receta-ensalada-manzana-tomate/
184,Ensalada de arroz al curry y pasas,240,https://queapetito.com/receta-ensalada-arroz-curry-pasas/
185,Alubias rojas y quinoa,190,https://queapetito.com/receta-alubias-rojas-quinoa/
186,Ensalada de champiñones laminados,66,https://queapetito.com/receta-ensalada-champinones-laminados/
187,Ensalada de alubias rojas,130,https://queapetito.com/receta-ensalada-alubias-rojas/
188,Ensalada con manzana asada,182,https://queapetito.com/receta-ensalada-manzana-asada/
189,Ensalada de Puerros,400,https://queapetito.com/receta-ensalada-puerros/
190,Ensalada templada de espinacas fritas,220,https://queapetito.com/receta-ensalada-templada-espinacas-fritas/
191,Ensalada de maíz y pepino,32,https://queapetito.com/receta-ensalada-maiz-pepino/
192,Ensalada de garbanzos con atún y aguacate,267,https://queapetito.com/receta-ensalada-garbanzos-atun-aguacate/
193,Ensalada cobb,190,https://queapetito.com/receta-ensalada-cobb/
194,Ensalada de col con salsa mostaza,170,https://queapetito.com/receta-ensalada-col-salsa-mostaza/
195,Ensalada de Patatas Veganas,144,https://queapetito.com/receta-ensalada-patatas-veganas/
196,Ensalada de manzana dulce,170,https://queapetito.com/receta-ensalada-manzana-dulce/
197,Ensalada de cogollos con atún,110,https://queapetito.com/receta-ensalada-cogollos-atun/
198,Ensalada Catalana,93,https://queapetito.com/receta-ensalada-catalana/
199,Ensalada tibia de setas y parmesano,100,https://queapetito.com/receta-ensalada-tibia-setas-parmesano/
200,"Ensalada de espinacas, manzana y queso",210,https://queapetito.com/receta-ensalada-espinacas-manzana-queso/
201,Ensalada de espinacas y pollo,210,https://queapetito.com/receta-ensalada-espinacas-pollo/
202,Ensalada de aguacate y atún,112,https://queapetito.com/receta-ensalada-aguacate-atun/
203,Ensalada de pasta con pollo,198,https://queapetito.com/receta-ensalada-pasta-pollo/
204,Macedonia de cítricos,140,https://queapetito.com/receta-macedonia-citricos/
205,Ensalada de rúcula y fresas,100,https://queapetito.com/receta-ensalada-rucula-fresas/
206,Ensalada de champiñones y tomate,210,https://queapetito.com/receta-ensalada-campinones-tomate/
207,"Ensalada de rúcula, naranja y queso",230,https://queapetito.com/receta-ensalada-rucula-naranja-queso/
208,Ensalada de remolacha y aguacate,516,https://queapetito.com/receta-ensalada-remolacha-aguacate/
209,Ensalada de Cardo rojo,350,https://queapetito.com/receta-ensalada-cardo-rojo/
210,Ensalada de Arenques y Remolacha,316,https://queapetito.com/receta-ensalada-arenques-remolacha/
211,Ensalada de Borujas,180,https://queapetito.com/receta-ensalada-borujas/
212,Xató de Sitges,540,https://queapetito.com/receta-xato-sitges/
213,Ensalada de rábanos,80,https://queapetito.com/receta-ensalada-rabanos/
214,Ensalada de Escarola con Anchoas,84,https://queapetito.com/receta-ensalada-escarola-anchoas/
215,Ensalada de calabaza,210,https://queapetito.com/receta-ensalada-calabaza/
216,Ensalada alemana con mortadela,263,https://queapetito.com/receta-ensalada-alemana-mortadela/
217,Ensalada de pasta con salmón,288,https://queapetito.com/receta-ensalada-pasta-salmon/
218,Ensalada de calabacín y nueces,300,https://queapetito.com/receta-ensalada-calabacin-nueces/
219,Ensalada de mango y langostinos,200,https://queapetito.com/receta-ensalada-mango-langostinos/
220,Ensalada de Alcachofa,265,https://queapetito.com/receta-ensalada-alcachofa/
221,Ensalada de aguacate y anchoas,170,https://queapetito.com/receta-ensalada-aguacate-anchoas/
222,Ensalada de Cardo,126,https://queapetito.com/receta-ensalada-cardo/
223,Ensalada de pulpo y mango,200,https://queapetito.com/receta-ensalada-pulpo-mango/
224,Ensalada de bogavante,250,https://queapetito.com/receta-ensalada-bogavante/
225,Ensalada con jamón y queso,130,https://queapetito.com/receta-ensalada-jamon-queso/
226,Chucrut casero,19,https://queapetito.com/receta-chucrut-casero/
227,"Ensalada de garbanzos, aguacate y tomate",270,https://queapetito.com/receta-ensalada-garbanzos-aguacate-tomate/
228,Ensalada de Espinacas y Champiñones,66,https://queapetito.com/receta-ensalada-espinacas-champinones/
229,Ensalada de anchoas y pimientos asados,160,https://queapetito.com/receta-ensalada-anchoas-pimientos-asados/
230,Ensalada de queso de cabra y anchoas,210,https://queapetito.com/receta-ensalada-queso-cabra-anchoas/
231,Ensaladilla con pulpo,170,https://queapetito.com/receta-ensaladilla-pulpo/
232,Ensalada de sandía y anchoas,300,https://queapetito.com/receta-ensalada-sandia-anchoas/
233,Ensalada de hojas de roble y nueces,210,https://queapetito.com/receta-ensalada-hojas-roble-nueces/
234,Ensalada de pulpo y aguacate,250,https://queapetito.com/receta-ensalada-pulpo-aguacate/
235,Carpaccio de melón,180,https://queapetito.com/receta-carpaccio-melon/
236,Ensalada de aguacate y mango,180,https://queapetito.com/receta-ensalada-aguacate-mango/
237,Ensalada de patata y aguacate,187,https://queapetito.com/receta-ensalada-patata-aguacate/
238,Ensalada nicoise,215,https://queapetito.com/receta-ensalada-nicoise/
239,Ensaladilla rusa para el verano,270,https://queapetito.com/receta-ensaladilla-rusa/
240,Ensalada arroz con salsa rosa,490,https://queapetito.com/receta-ensalada-arroz-salsa-rosa/
241,Ensalada de pasta con queso de cabra,250,https://queapetito.com/receta-ensalada-pasta-queso-cabra/
242,Ensalada de Patatas y Gambas,255,https://queapetito.com/receta-ensalada-patatas-gambas/
243,Ensalada Templada de Gulas y Gambas,233,https://queapetito.com/receta-ensalada-templada-gulas-gambas/
244,Ensalada de Pasta con Atún,400,https://queapetito.com/receta-ensalada-pasta-atun/
245,Ensalada de pollo al curry,277,https://queapetito.com/receta-ensalada-pollo-curry/
246,Ensalada de Pollo y Piña,245,https://queapetito.com/receta-ensalada-pollo-pina/
247,Ensalada Alemana de Patatas,214,https://queapetito.com/receta-ensalada-alemana-patatas/
248,Ensalada Marinera,151,https://queapetito.com/receta-ensalada-marinera/
249,Ensalada china,50,https://queapetito.com/receta-ensalada-china/
250,Ensalada pazanella,415,https://queapetito.com/receta-ensalada-pazanella/
251,Ensalada de manzana,320,https://queapetito.com/receta-ensalada-manzana/
252,Ensalada Chilena,89,https://queapetito.com/receta-ensalada-chilena/
253,Ensalada agridulce con piña,200,https://queapetito.com/receta-ensalada-agridulce-pina/
254,Ensalada de Endivias con Atún,276,https://queapetito.com/receta-ensalada-endivias-atun/
255,Ensalada japonesa de pepino,50,https://queapetito.com/receta-ensalada-japonesa-pepino/
256,Ensalada con Brotes de Soja,240,https://queapetito.com/receta-ensalada-brotes-soja/
257,Ensalada de burrata,263,https://queapetito.com/receta-ensalada-burrata/
258,Ensalada de melón y queso,410,https://queapetito.com/receta-ensalada-melon-queso/
259,Ensalada de espinacas con queso de cabra,350,https://queapetito.com/receta-ensalada-espinacas-queso-cabra/
260,Ensalada César,44,https://queapetito.com/receta-ensalada-cesar/
261,Carpaccio de tomate con parmesano,255,https://queapetito.com/receta-carpaccio-tomate-parmesano/
262,Ensalada israelí,160,https://queapetito.com/receta-ensalada-israeli/
263,Ensalada de garbanzos,190,https://queapetito.com/ensalada-garbanzos/
264,Ensalada de col lombarda,150,https://queapetito.com/receta-ensalada-col-lombarda/
265,Ensalada diurética de frutas,190,https://queapetito.com/receta-ensalada-diuretica-frutas/
266,Ensalada de arroz con aguacate,320,https://queapetito.com/receta-ensalada-arroz-aguacate/
267,Ensalada de mango y pollo,350,https://queapetito.com/receta-ensalada-mango-pollo/
268,Salpicón de pollo,350,https://queapetito.com/receta-salpicon-pollo/
269,Ensalada de cogollos con anchoas,198,https://queapetito.com/receta-ensalada-cogollos-anchoas/
270,Tabulé de quinoa,230,https://queapetito.com/receta-tabule-quinoa/
271,Ensaladilla con bacalao,607,https://queapetito.com/receta-ensaladilla-bacalao/
272,Ensalada de Algas Wakame,30,https://queapetito.com/receta-ensalada-algas-wakame/
273,Ensalada de rúcula y queso parmesano,120,https://queapetito.com/receta-ensalada-rucula-queso-parmesano/
274,Ensaladilla de gambas,350,https://queapetito.com/receta-ensaladilla-gambas/
275,Ensalada de apio y lechuga,116,https://queapetito.com/receta-ensalada-apio-lechuga/
276,Ensalada Louisiana,335,https://queapetito.com/receta-ensalada-louisiana/
277,Ensalada de cítricos,100,https://queapetito.com/receta-ensalada-citricos/
