,name_food,calories,link
574,Timbal de manzana y pollo,169,https://queapetito.com/receta-timbal-manzana-pollo/
575,Hamburguesas Caseras con Queso Roquefort,296,https://queapetito.com/receta-hamburguesas-caseras-queso-roquefort/
576,Conejo en salmorejo,315,https://queapetito.com/receta-conejo-salmorejo/
577,Conejo en escabeche,315,https://queapetito.com/receta-conejo-escabeche/
578,Liebre en salsa de verduras,154,https://queapetito.com/receta-liebre-salsa-verduras/
579,Pollo frito con almendras,610,https://queapetito.com/receta-pollo-frito-almendras/
580,Albóndigas en salsa de cebolla,140,https://queapetito.com/receta-albondigas-salsa-cebolla/
581,Cabrito en salsa de almendras,315,https://queapetito.com/receta-cabrito-salsa-almendras/
582,Pechugas de pollo rellenas,230,https://queapetito.com/receta-pechugas-pollo-rellenas/
583,Estofado de Buey picante,278,https://queapetito.com/receta-estofado-buey-picante/
584,Pechugas de pollo asadas,164,https://queapetito.com/receta-pechugas-pollo-asadas/
585,Bandeja paisa típico colombiano,1822,https://queapetito.com/receta-bandeja-paisa-tipico-colombiano/
586,Solomillo en salsa de frutos rojos,250,https://queapetito.com/receta-solomillo-salsa-frutos-rojos/
587,Pechugas de pollo al queso,228,https://queapetito.com/receta-pechugas-pollo-queso/
588,Butifarra esparracada,229,https://queapetito.com/receta-butifarra-esparracada/
589,Pechugas de pollo con nata,270,https://queapetito.com/receta-pechugas-pollo-nata/
590,Manitas de cerdo con Salsa Asturiana,392,https://queapetito.com/receta-manitas-cerdo-salsa-asturiana/
591,Pollo empanado con queso,242,https://queapetito.com/receta-pollo-empanado-queso/
592,Estofado de liebre,114,https://queapetito.com/receta-estofado-liebre/
593,"Brocheta de Pollo, Manzana y Curry",167,https://queapetito.com/receta-brocheta-pollo-manzana-curry/
594,Conejo con salsa gorgonzola,380,https://queapetito.com/receta-conejo-salsa-gorgonzola/
595,Codornices a la toledana,308,https://queapetito.com/receta-codornices-toledana/
596,Estofado de Ternera en Olla Express,319,https://queapetito.com/receta-estofado-ternera-olla-express/
597,Conejo guisado con patatas,250,https://queapetito.com/receta-conejo-guisado-patatas/
598,Estofado de ternera al tomillo,320,https://queapetito.com/receta-estofado-ternera-tomillo/
599,Codornices con alubias blancas,310,https://queapetito.com/receta-codornices-alubias-blancas/
600,Chorizos al vino blanco,302,https://queapetito.com/receta-chorizos-vino-blanco/
601,Chorizos al disco con salsa pomarola,490,https://queapetito.com/receta-chorizos-disco-salsa-pomarola/
602,Chocos guisados,260,https://queapetito.com/receta-chocos-guisados/
603,Ternera a la jardinera con olla exprés,310,https://queapetito.com/receta-ternera-jardinera-olla-expres/
604,Estofado de ternera con alcachofas,350,https://queapetito.com/receta-estofado-ternera-alcachofas/
605,Codornices Estofadas,247,https://queapetito.com/receta-codornices-estofadas/
606,Estofado de Pollo a la Ecuatoriana,332,https://queapetito.com/receta-estofado-pollo-ecuatoriana/
607,Estofado de Patatas y Pulpo,301,https://queapetito.com/estofado-patatas-pulpo/
608,Estofado de ternera al vino tinto,270,https://queapetito.com/receta-estofado-ternera-vino-tinto/
609,Estofado de patatas vegetariano,200,https://queapetito.com/receta-estofado-patatas-vegetariano/
610,Estofado de Carne con Patatas,279,https://queapetito.com/receta-estofado-carne-patatas/
611,Chipirones con guisantes,325,https://queapetito.com/receta-chipirones-guisantes/
612,Sopa de Frijoles Blancos,221,https://queapetito.com/receta-sopa-frijoles-blancos/
613,Estofado de Pollo con Verduras,279,https://queapetito.com/receta-estofado-pollo-verduras/
614,Pollo en pepitoria casero,230,https://queapetito.com/receta-pollo-pepitoria-casero/
615,Estofado de Ternera con Verduras,279,https://queapetito.com/receta-estofado-ternera-verduras/
616,Estofado de Conejo a la Cazadora,311,https://queapetito.com/receta-estofado-conejo-cazadora/
617,Puré de patata con queso,210,https://queapetito.com/receta-pure-patata-queso/
618,Estofado de ternera con patatas,318,https://queapetito.com/receta-estofado-ternera-patatas/
619,Guiso de patatas con mejillones,240,https://queapetito.com/receta-guiso-patatas-mejillones/
620,Alubias Verdinas con Sepia,310,https://queapetito.com/receta-alubias-verdinas-sepia/
621,Menestra fácil de cordero,250,https://queapetito.com/receta-menestra-facil-cordero/
622,Mejillones con cebolla y tomate,120,https://queapetito.com/receta-mejillones-cebolla-tomate/
623,Menestra de setas,250,https://queapetito.com/receta-menestra-setas/
624,Menestra con pollo,450,https://queapetito.com/receta-menestra-pollo/
625,Caldereta de Bogavante,118,https://queapetito.com/receta-caldereta-bogavante/
626,Menestra de cordero,350,https://queapetito.com/receta-menestra-cordero/
627,Alubias Verdinas con Chorizo,375,https://queapetito.com/receta-alubias-verdinas-chorizo/
628,Garbanzos con callos,340,https://queapetito.com/receta-garbanzos-callos/
629,Muslitos de pollo guisados,250,https://queapetito.com/receta-muslitos-pollo-guisados/
630,Garbanzos a la catalana,350,https://queapetito.com/receta-garbanzos-catalana/
631,Judías pintas con chorizo,220,https://queapetito.com/receta-judias-pintas-chorizo/
632,Garbanzos con Setas y Bacalao,368,https://queapetito.com/receta-garbanzos-setas-bacalao/
633,Guiso de ternera con garbanzos,450,https://queapetito.com/receta-guiso-ternera-garbanzos/
634,Cazuela de Mondongo,348,https://queapetito.com/receta-cazuela-mondongo/
635,Guisantes con Gambas,257,https://queapetito.com/receta-guisantes-gambas/
636,Garbanzos con Tomate y Cebolla,234,https://queapetito.com/receta-garbanzos-tomate-cebolla/
637,Garbanzos con chorizo,250,https://queapetito.com/receta-garbanzos-chorizo/
638,Garbanzos con Pulpo,338,https://queapetito.com/receta-garbanzos-pulpo/
639,Garbanzos con Morcilla,279,https://queapetito.com/receta-garbanzos-morcilla/
640,Goulash de ternera a la húngara,300,https://queapetito.com/receta-goulash-ternera-hungara/
641,Guiso de Calamares con Patatas,279,https://queapetito.com/receta-guiso-calamares-patatas/
642,Judías pintas con arroz,215,https://queapetito.com/receta-judias-pintas-arroz/
643,Suquet de pescado,190,https://queapetito.com/receta-suquet-pescado/
644,Cazuela de fideos con tomate,300,https://queapetito.com/receta-cazuela-fideos-tomate/
645,Sepia estofada con tomate,228,https://queapetito.com/receta-sepia-estofada-tomate/
646,Alubias blancas con bacalao,274,https://queapetito.com/receta-alubias-blancas-bacalao/
647,Alubias rojas con arroz,250,https://queapetito.com/receta-alubias-rojas-arroz/
648,Alubias blancas estofadas,205,https://queapetito.com/receta-alubias-blancas-estofadas/
649,Estofado de espárragos trigueros con patatas,250,https://queapetito.com/receta-estofado-esparragos-trigueros-patatas/
650,Ternera asada con patatas nuevas,450,https://queapetito.com/receta-ternera-asada-patatas-nuevas/
651,Alubias rojas con chorizo,287,https://queapetito.com/receta-alubias-rojas-chorizo/
652,Potaje de Acelgas Murciano,289,https://queapetito.com/receta-potaje-acelgas-murciano/
653,Alubias rojas de tolosa en olla exprés,336,https://queapetito.com/receta-alubias-rojas-tolosa-olla-expres/
654,Estofado de pavo,180,https://queapetito.com/receta-estofado-pavo/
655,Alubias rojas con verduras,180,https://queapetito.com/receta-alubias-rojas-verduras/
656,Cabrito guisado casero,280,https://queapetito.com/receta-cabrito-guisado-casero/
657,Judías verdes con chorizo,150,https://queapetito.com/receta-judias-verdes-chorizo/
658,Congrio a la Marinera,280,https://queapetito.com/receta-congrio-marinera/
659,Codornices en escabeche,250,https://queapetito.com/receta-codornices-escabeche/
660,Gachas manchegas,330,https://queapetito.com/receta-gachas-manchegas/
661,Caponata Siciliana,99,https://queapetito.com/receta-caponata-siciliana/
662,Garbanzos con Grelos,216,https://queapetito.com/receta-garbanzos-grelos/
663,Lentejas con chorizo,388,https://queapetito.com/receta-lentejas-chorizo/
664,Guiso de alcachofas con patatas,220,https://queapetito.com/receta-guiso-alcachofas-patatas/
665,Callos veganos,280,https://queapetito.com/receta-callos-veganos/
666,Alubias con bacalao,318,https://queapetito.com/receta-alubias-bacalao/
667,Alubias con arroz,160,https://queapetito.com/receta-alubias-arroz/
668,Salteado de setas,160,https://queapetito.com/receta-salteado-setas/
669,Caldo Verde Portugués,558,https://queapetito.com/receta-caldo-verde-portugues-2/
670,Acelgas con garbanzos,298,https://queapetito.com/receta-acelgas-garbanzos/
671,Pollo a la cazadora,330,https://queapetito.com/receta-pollo-cazadora/
672,Michirones murcianos,348,https://queapetito.com/receta-michirones-murcianos/
673,Alubias verdinas con langostinos,272,https://queapetito.com/receta-alubias-verdinas-langostinos/
674,Alubias con morcilla,380,https://queapetito.com/receta-alubias-morcilla/
675,Patatas a la Riojana,350,https://queapetito.com/receta-patatas-riojana/
676,Ropa vieja,374,https://queapetito.com/receta-ropa-vieja/
677,Judiones con chorizo,377,https://queapetito.com/receta-judiones-chorizo/
678,Judiones a la granja,180,https://queapetito.com/receta-judiones-granja/
679,Acelgas esparragadas,150,https://queapetito.com/receta-acelgas-esparragadas/
680,Garbanzos con langostinos,319,https://queapetito.com/receta-garbanzos-langostinos/
681,Pollo al chilindrón,500,https://queapetito.com/receta-pollo-chilindron/
682,Ragout de Ternera,420,https://queapetito.com/receta-ragout-ternera/
683,Almejas con pochas,320,https://queapetito.com/receta-almejas-pochas/
684,Callos a la Gallega,427,https://queapetito.com/receta-callos-gallega/
685,Alubias con Chorizo,387,https://queapetito.com/receta-alubias-chorizo/
686,Alubias rojas estofadas,420,https://queapetito.com/receta-alubias-rojas-estofadas/
687,Potaje de Vigilia Tradicional,251,https://queapetito.com/receta-potaje-vigilia-tradicional/
688,Alubias con Verduras,243,https://queapetito.com/receta-alubias-verduras/
689,Alubias Negras con Chorizo,357,https://queapetito.com/receta-alubias-negras-chorizo/
690,Pochas a la navarra,86,https://queapetito.com/receta-pochas-navarra/
691,Pochas a la riojana,300,https://queapetito.com/receta-pochas-riojana/
692,Suquet o guiso de rape,180,https://queapetito.com/receta-suquet-guiso-rape/
693,Patatas guisadas con sepia,300,https://queapetito.com/receta-patatas-guisadas-sepia/
694,Guiso de habichuelas,300,https://queapetito.com/receta-guiso-habichuelas/
695,Sangre con tomate tradicional de cádiz,200,https://queapetito.com/receta-sangre-tomate-tradicional-cadiz/
696,Potaje de lentejas,1760,https://queapetito.com/receta-potaje-lentejas/
697,Garbanzos con Sepia,269,https://queapetito.com/receta-garbanzos-sepia/
698,Pollo Guisado,298,https://queapetito.com/receta-pollo-guisado/
699,Ramen Fácil de Preparar,436,https://queapetito.com/receta-ramen-facil-preparar/
700,Cocido de garbanzos con verduras,270,https://queapetito.com/receta-cocido-garbanzos-verduras/
701,Lentejas con Verduras,168,https://queapetito.com/receta-lentejas-verduras/
702,Guiso de níscalos con patatas,167,https://queapetito.com/receta-guiso-niscalos-patatas/
703,Puchero casero,305,https://queapetito.com/receta-puchero-casero/
704,Pollo con ciruelas,160,https://queapetito.com/receta-pollo-ciruelas/
705,Pollo en Salsa de Almendras,381,https://queapetito.com/receta-pollo-salsa-almendras/
706,Potaje de bacalao,220,https://queapetito.com/receta-potaje-bacalao/
707,Tiznao manchego,285,https://queapetito.com/receta-tiznao-manchego/
708,Berza con Garbanzos,358,https://queapetito.com/receta-berza-con-garbanzos/
709,Habas a la Catalana,543,https://queapetito.com/receta-habas-catalana/
710,Alubias con setas,240,https://queapetito.com/receta-alubias-setas/
711,Chorizo a la sidra,264,https://queapetito.com/receta-chorizos-sidra/
712,Lentejas en olla express,280,https://queapetito.com/receta-lentejas-olla-express/
713,Champiñones con jamón,148,https://queapetito.com/receta-champinones-jamon-acompanamiento/
714,Patatas en Ajopollo como en Almería,600,https://queapetito.com/receta-patatas-ajopollo-como-almeria/
715,Cocido Madrileño,150,https://queapetito.com/receta-cocido-madrileno/
716,Garbanzos con bacalao y espinacas,300,https://queapetito.com/receta-garbanzos-bacalao-espinacas/
717,Pollo al Limón con Gurullos,400,https://queapetito.com/receta-pollo-limon-gurullos/
718,Pollo a la Cerveza,670,https://queapetito.com/receta-pollo-cerveza/
719,Estofado de ternera con zanahoria y cebolla,210,https://queapetito.com/receta-estofado-ternera-zanahoria-cebolla/
720,Alubias con almejas,340,https://queapetito.com/receta-alubias-almejas/
721,Tajine de pollo,210,https://queapetito.com/receta-tajine-pollo/
722,Berza Jerezana,200,https://queapetito.com/receta-berza-jerezana/
723,Lentejas guisadas como plato único,390,https://queapetito.com/receta-lentejas-guisadas/
724,Carne guisada con patatas,300,https://queapetito.com/receta-carne-guisada-patatas/
725,Callos a la madrileña en olla a presión,510,https://queapetito.com/receta-callos-madrilena-olla-presion/
726,Choclillo relleno con papas cocidas,288,https://queapetito.com/receta-choclillo-relleno-papas-cocidas/
727,Secreto de cerdo al horno con queso,458,https://queapetito.com/receta-secreto-cerdo-horno-queso/
728,Churrasco de pollo,315,https://queapetito.com/receta-churrasco-pollo/
729,Conejo al Horno con Patatas,312,https://queapetito.com/receta-conejo-horno-patatas/
730,Tallarines gratinados al horno,350,https://queapetito.com/receta-tallarines-gratinados-horno/
731,Faisán con trufas,205,https://queapetito.com/receta-faisan-trufas/
732,Codillo en Salmuera al Horno,278,https://queapetito.com/receta-codillo-salmuera-horno/
733,Coles de bruselas con bechamel al horno,280,https://queapetito.com/receta-coles-bruselas-bechamel-horno/
734,Puerros rellenos de gambas,210,https://queapetito.com/receta-puerros-rellenos-gambas/
735,Soufflé de queso con jamón,190,https://queapetito.com/receta-souffle-queso-jamon/
736,Tostadas con Ajo,54,https://queapetito.com/receta-tostadas-ajo/
737,Coles de bruselas al horno con miel,180,https://queapetito.com/receta-coles-bruselas-horno-miel/
738,Secreto al horno,420,https://queapetito.com/receta-secreto-horno/
739,Bizcocho de Canela y Vainilla,140,https://queapetito.com/receta-bizcocho-canela-vainilla/
740,Soufflé de pollo con pan bimbo,250,https://queapetito.com/receta-souffle-pollo-pan-bimbo/
741,Aguacate al horno con huevo,140,https://queapetito.com/receta-aguacate-horno-huevo/
742,Quesadillas de pollo y queso al horno,563,https://queapetito.com/receta-quesadillas-pollo-queso-horno/
743,Soufflé de Atún,189,https://queapetito.com/receta-souffle-atun/
744,Puerros gratinados con parmesano,170,https://queapetito.com/receta-puerros-gratinados-parmesano/
745,Puerros rellenos de carne picada,360,https://queapetito.com/receta-puerros-rellenos-carne-picada/
746,Soufflé de arroz con queso,290,https://queapetito.com/receta-souffle-arroz-queso/
747,Salmón al horno con salsa romesco,250,https://queapetito.com/receta-salmon-horno-salsa-romesco/
748,Soufflé de pescado,180,https://queapetito.com/receta-souffle-pescado/
749,Canelones de berenjena,113,https://queapetito.com/receta-canelones-berenjena/
750,Cochifrito al horno,245,https://queapetito.com/receta-cochifrito-horno/
751,Canelones de tofu y verduras,315,https://queapetito.com/receta-canelones-tofu-verduras/
752,"Tiropita, pastelito griego con masa filo",370,https://queapetito.com/receta-tiropita/
753,Canelones de Soja Texturizado,177,https://queapetito.com/receta-canelones-soja-texturizado/
754,Alcachofa de Jerusalén al horno,73,https://queapetito.com/receta-alcachofa-jerusalen-horno/
755,Canelones de Boletus,370,https://queapetito.com/receta-canelones-boletus/
756,Muslos de pavos al horno,220,https://queapetito.com/receta-muslos-pavos-horno/
757,Frittata al horno,230,https://queapetito.com/receta-frittata-horno/
758,Muslos de pollo a la naranja,340,https://queapetito.com/receta-muslos-pollo-naranja/
759,Spanakopita o Pastel Griego de Espinacas,223,https://queapetito.com/receta-spanakopita-o-pastel-griego-espinacas/
760,Canelones de berenjenas rellenos de atún,205,https://queapetito.com/receta-canelones-berenjenas-rellenos-atun/
761,Costillas con salsa barbacoa,350,https://queapetito.com/receta-costillas-salsa-barbacoa/
762,Canelones de jamón y queso,145,https://queapetito.com/receta-canelones-jamon-queso/
763,Enchilada suiza,490,https://queapetito.com/receta-enchilada-suiza/
764,Cabrito al horno,290,https://queapetito.com/receta-cabrito-horno/
765,Pollo rústico al horno,318,https://queapetito.com/receta-pollo-rustico-horno/
766,Empanadillas de Espinacas y Queso de Cabra,220,https://queapetito.com/receta-empanadillas-espinacas-queso-cabra/
767,Empanada morcilla y pera,269,https://queapetito.com/receta-empanada-morcilla-pera/
768,Pollo asado con uvas,324,https://queapetito.com/receta-pollo-asado-uvas/
769,Pollo con verduras asadas,280,https://queapetito.com/receta-pollo-verduras-asadas/
770,Gratinado de espinacas y gambas,200,https://queapetito.com/receta-gratinado-espinacas-gambas/
771,Hornazo de salamanca,320,https://queapetito.com/receta-hornazo-salamanca/
772,Vieiras gratinadas al horno,329,https://queapetito.com/receta-vieiras-gratinadas-horno/
773,Langostinos al horno fácil,88,https://queapetito.com/receta-langostinos-horno-facil/
774,Setas al horno,370,https://queapetito.com/receta-setas-horno/
775,Endivias al horno con bechamel,330,https://queapetito.com/receta-endivias-horno-bechamel/
776,Cazuela de esparragos trigueros,250,https://queapetito.com/receta-cazuela-esparragos-trigueros/
777,Quiché de champiñones sin nata,350,https://queapetito.com/receta-quiche-champinones-sin-nata/
778,Endivias gratinadas,330,https://queapetito.com/receta-endivias-gratinadas/
779,Mejillones al horno,255,https://queapetito.com/receta-mejillones-horno/
780,Quiche de bacon casera,269,https://queapetito.com/receta-quiche-bacon-casera/
781,Cabrito asado con hortalizas,315,https://queapetito.com/receta-cabrito-asado-hortalizas/
782,Empanada de champiñones vegana,220,https://queapetito.com/receta-empanada-champinones-vegana/
783,Quiché de puerros y queso de cabra,160,https://queapetito.com/receta-quiche-puerros-queso-cabra/
784,Coliflor a la crema de queso,250,https://queapetito.com/receta-coliflor-crema-queso/
785,Matambre arrollado al horno,241,https://queapetito.com/receta-matambre-arrollado-horno/
786,Melocotones asados en el horno,70,https://queapetito.com/receta-melocotones-asados-horno/
787,Galletas de centeno,481,https://queapetito.com/receta-galletas-centeno/
788,Quesadilla Pasiega,267,https://queapetito.com/receta-quesadilla-pasiega/
789,Pastel de champiñones,203,https://queapetito.com/receta-pastel-champinones/
790,Pastel de acelga y patatas,250,https://queapetito.com/receta-pastel-acelga-patatas/
791,Pastel de Puerros y Champiñones,156,https://queapetito.com/receta-pastel-puerros-champinones/
792,Lasaña de carne con bechamel,336,https://queapetito.com/receta-lasana-carne-bechamel/
793,Quiché de champiñones y queso de cabra,550,https://queapetito.com/receta-quiche-champinones-queso-cabra/
794,Lomo a las Finas Hierbas,343,https://queapetito.com/receta-lomo-finas-hierbas/
795,Quiche de berenjenas,171,https://queapetito.com/receta-quiche-berenjenas/
796,Quiche de ajos tiernos,170,https://queapetito.com/receta-quiche-ajos-tiernos/
797,Quiche de Pollo,428,https://queapetito.com/receta-quiche-pollo/
798,Quiché de puerros y salmón,380,https://queapetito.com/receta-quiche-puerros-salmon/
799,Berenjenas rellenas de atún,180,https://queapetito.com/receta-berenjenas-rellenas-atun-facil/
800,Quiché de tofu,130,https://queapetito.com/receta-quiche-tofu/
801,Tomates rellenos de arroz,230,https://queapetito.com/receta-tomates-rellenos-arroz/
802,Butifarra al horno con patatas,400,https://queapetito.com/receta-butifarra-horno-patatas/
803,Bacalao Skrei al Horno,193,https://queapetito.com/receta-bacalao-skrei-horno/
804,Puerros al horno,185,https://queapetito.com/receta-puerros-horno/
805,Empanada de Salmón,246,https://queapetito.com/receta-empanada-salmon/
806,Pollo Empanado al Horno,274,https://queapetito.com/receta-pollo-empanado-horno/
807,Berenjenas con atún y mozzarella,180,https://queapetito.com/receta-berenjenas-atun-mozzarella/
808,Lasaña de berenjenas y calabacín,320,https://queapetito.com/receta-lasana-berenjenas-calabacin/
809,Cebollas asadas,45,https://queapetito.com/receta-cebollas-asadas/
810,Lasaña de kale,350,https://queapetito.com/receta-lasana-kale/
811,Lasaña de puerros y jamón,340,https://queapetito.com/receta-lasana-puerros-jamon/
812,Champiñones Rellenos de Jamón,142,https://queapetito.com/receta-champinones-rellenos-jamon/
813,Boquerones al Horno,182,https://queapetito.com/receta-boquerones-horno/
814,Soufflé de Patatas,250,https://queapetito.com/receta-souffle-patatas/
815,Pimientos rellenos de atún,230,https://queapetito.com/receta-pimientos-rellenos-atun/
816,Patatas rellenas de jamón y queso,390,https://queapetito.com/receta-patatas-rellenas-jamon-queso/
817,Champiñones al horno,22,https://queapetito.com/receta-champinones-horno-2/
818,Salmón en papillote,250,https://queapetito.com/receta-salmon-papillote/
819,Patatas Duquesa,105,https://queapetito.com/receta-patatas-duquesa/
820,Pollo Asado con Salsa de Setas,311,https://queapetito.com/receta-pollo-asado-salsa-setas/
821,Empanada de Sardinas,212,https://queapetito.com/receta-empanada-sardinas/
822,Pollo asado al limón,360,https://queapetito.com/receta-pollo-asado-limon/
823,Mazorcas de maíz al horno,100,https://queapetito.com/receta-mazorcas-maiz-horno/
824,Galletas de la fortuna o suerte,370,https://queapetito.com/receta-galletas-fortuna-suerte/
825,Tomates rellenos al horno,280,https://queapetito.com/receta-tomates-rellenos-horno/
826,Empanadas de Espinacas,235,https://queapetito.com/receta-empanadas-espinacas/
827,Berenjenas rellenas de atún,310,https://queapetito.com/receta-berenjenas-rellenas-atun/
828,Canelones de choclo,299,https://queapetito.com/receta-canelones-choclo/
829,Berenjenas al roquefort,290,https://queapetito.com/receta-berenjenas-roquefort/
830,Empanada de bacalao,230,https://queapetito.com/receta-empanada-bacalao/
831,Berenjenas rellenas de champiñones,250,https://queapetito.com/receta-berenjenas-rellenas-champinones/
832,Soufflé de espinacas,492,https://queapetito.com/souffle-espinacas/
833,Alitas de pollo en salsa barbacoa,390,https://queapetito.com/receta-alitas-pollo-salsa-barbacoa/
834,Canelones de verduras,380,https://queapetito.com/receta-canelones-verduras/
835,Empanada de morcilla,288,https://queapetito.com/receta-empanada-morcilla/
836,Cigalas al horno,150,https://queapetito.com/receta-cigalas-horno/
837,Berenjenas rellenas de bacalao,200,https://queapetito.com/receta-berenjenas-rellenas-bacalao/
838,Masa para tartaletas fácil,310,https://queapetito.com/receta-masa-tartaletas-facil/
839,Lomo de cerdo al horno,250,https://queapetito.com/receta-lomo-cerdo-horno/
840,Cordero a la miel,350,https://queapetito.com/receta-cordero-miel/
841,Lasaña de carne y queso,475,https://queapetito.com/receta-lasana-carne-queso/
842,Pulpo al horno,57,https://queapetito.com/receta-pulpo-horno/
843,Patatas a la Rafaela,380,https://queapetito.com/receta-patatas-rafaela/
844,Pizza barbacoa,390,https://queapetito.com/receta-pizza-barbacoa/
845,Trenza de Hojaldre Salada,347,https://queapetito.com/receta-trenza-hojaldre-salada/
846,Pollo al horno fácil,118,https://queapetito.com/receta-pollo-horno-facil/
847,Soufflé de queso,310,https://queapetito.com/receta-souffle-queso/
848,Espárragos rellenos,218,https://queapetito.com/receta-esparragos-rellenos/
849,Ñoquis al horno,300,https://queapetito.com/receta-noquis-horno/
850,Lasaña de Pollo,436,https://queapetito.com/receta-lasana-pollo/
851,Costillas de cabrito al horno,160,https://queapetito.com/receta-costillas-cabrito-horno/
852,Confit de pato,250,https://queapetito.com/receta-confit-pato/
853,Recetas fáciles de Tartas saladas,250,https://queapetito.com/receta-faciles-tartas-saladas/
854,Lasaña de berenjenas,287,https://queapetito.com/receta-lasana-berenjenas/
855,Merluza al horno,120,https://queapetito.com/receta-merluza-horno/
856,Albóndigas al horno,398,https://queapetito.com/receta-albondigas-horno/
857,Calabacín relleno con carne,350,https://queapetito.com/receta-calabacin-relleno-carne/
858,Patatas asadas al horno,150,https://queapetito.com/receta-patatas-asadas-horno/
859,Pato a la naranja,450,https://queapetito.com/receta-pato-naranja/
860,Empanadillas al horno,225,https://queapetito.com/receta-empanadillas-horno/
861,Quiche de Calabacín,450,https://queapetito.com/receta-quiche-calabacin/
862,Quiche de verduras,130,https://queapetito.com/receta-quiche-verduras/
863,Redondo de ternera al horno,490,https://queapetito.com/receta-redondo-ternera-horno/
864,Solomillo a la mostaza,450,https://queapetito.com/receta-solomillo-mostaza/
865,Filetes de Pollo al horno,145,https://queapetito.com/receta-filetes-pollo-horno/
866,Berenjenas rellenas de carne picada,350,https://queapetito.com/receta-berenjenas-rellenas-carne-picada/
867,Jamoncitos de Pollo al horno con patatas,282,https://queapetito.com/receta-jamoncitos-pollo-horno-patatas/
868,Huevos con bechamel,484,https://queapetito.com/receta-huevos-bechamel/
869,Chuletas de Cerdo al Horno,324,https://queapetito.com/receta-chuletas-cerdo-horno/
870,Patatas Gratinadas,435,https://queapetito.com/receta-patatas-gratinadas/
871,Hojaldre de langostinos y puerros,350,https://queapetito.com/receta-hojaldre-langostinos-puerros/
872,Solomillo de cerdo al horno,158,https://queapetito.com/receta-solomillo-cerdo-horno/
873,Pierna de cordero al horno,278,https://queapetito.com/receta-pierna-cordero-horno/
874,Arepas venezolanas,108,https://queapetito.com/receta-arepas-venezolanas/
875,Brócoli Gratinado,120,https://queapetito.com/receta-brocoli-gratinado/
